{
  "name": "claude-alchemy",
  "description": "Directory of Claude Code extensions including development tools, productivity plugins, and MCP integrations",
  "owner": {
    "name": "Stephen Sequenzia",
    "email": "sequenzia@gmail.com"
  },
  "plugins": [
    {
      "name": "claude-alchemy-agents",
      "description": "Developer tools for feature development, Git workflows, and release automation",
      "version": "0.1.0",
      "author": {
        "name": "Stephen Sequenzia",
        "email": "sequenzia@gmail.com"
      },
      "source": "./plugins/agents/",
      "category": "development",
      "homepage": "https://github.com/sequenzia/claude-alchemy/tree/main/claude-tools/dev-tools"
    },
    {
      "name": "claude-alchemy-tools",
      "description": "Developer tools for feature development, Git workflows, and release automation",
      "version": "0.1.0",
      "author": {
        "name": "Stephen Sequenzia",
        "email": "sequenzia@gmail.com"
      },
      "source": "./plugins/tools/",
      "category": "development",
      "homepage": "https://github.com/sequenzia/claude-alchemy/tree/main/claude-tools/dev-tools"
    },
    {
      "name": "claude-alchemy-sdd",
      "description": "Developer tools for feature development, Git workflows, and release automation",
      "version": "0.1.0",
      "author": {
        "name": "Stephen Sequenzia",
        "email": "sequenzia@gmail.com"
      },
      "source": "./plugins/sdd/",
      "category": "development",
      "homepage": "https://github.com/sequenzia/claude-alchemy/tree/main/claude-tools/dev-tools"
    }
  ]
}
